{
  "$schema": "../../../schemas/v1/save_state.schema.json",
  "name": "Stair: Charlock B5 → B4 (up stairs at 10,1)",
  "description": "Debug save state for stair transition: Charlock B5 → B4 (up stairs at 10,1). Hero stands on the stair tile ready to transition.",
  "scene": "CharlockCastleB5",
  "tile": "10,1",
  "facing": "up",
  "come_from": "debug",
  "gold": 20000,
  "hero_name": "ERDRICK",
  "hero_level": 20,
  "hero_hp": 138,
  "hero_hp_max": 138,
  "hero_mp": 115,
  "hero_mp_max": 115,
  "hero_str": 34,
  "hero_agl": 36,
  "hero_atk": 34,
  "hero_def": 32,
  "hero_exp": 29000,
  "hero_weapon": "erdricks_sword",
  "hero_armor": "erdricks_armor",
  "hero_spells": [
    "heal",
    "hurt",
    "sleep",
    "radiant",
    "stopspell",
    "outside",
    "return",
    "repel",
    "healmore",
    "hurtmore"
  ],
  "items": [],
  "opened_chests": {},
  "unlocked_doors": {},
  "bridge_built": true
}
