{
  "$schema": "../../../schemas/v1/save_state.schema.json",
  "name": "Level 11 - Grave of Garin Upper",
  "description": "Level 11 preset at the upper reaches of Garin's Grave with spells through Stopspell.",
  "scene": "GarinhamB1",
  "tile": "6,1",
  "facing": "right",
  "come_from": "garinham",
  "gold": 2500,
  "hero_name": "ERDRICK",
  "hero_level": 11,
  "hero_hp": 62,
  "hero_hp_max": 62,
  "hero_mp": 46,
  "hero_mp_max": 46,
  "hero_str": 18,
  "hero_agl": 18,
  "hero_atk": 18,
  "hero_def": 16,
  "hero_exp": 2900,
  "hero_weapon": "broad_sword",
  "hero_armor": "half_plate",
  "hero_spells": [
    "heal",
    "hurt",
    "sleep",
    "radiant",
    "stopspell"
  ],
  "items": [],
  "opened_chests": {},
  "unlocked_doors": {},
  "bridge_built": false
}
