{
  "$schema": "../../../schemas/v1/save_state.schema.json",
  "name": "Level 19 - Charlock Entrance",
  "description": "Level 19 Charlock entrance preset with Hurtmore unlocked and the Rainbow Bridge already built.",
  "scene": "CharlockCastle1F",
  "tile": "11,20",
  "facing": "up",
  "come_from": "world_map",
  "gold": 18000,
  "hero_name": "ERDRICK",
  "hero_level": 19,
  "hero_hp": 130,
  "hero_hp_max": 130,
  "hero_mp": 108,
  "hero_mp_max": 108,
  "hero_str": 32,
  "hero_agl": 34,
  "hero_atk": 32,
  "hero_def": 32,
  "hero_exp": 25000,
  "hero_weapon": "flame_sword",
  "hero_armor": "erdricks_armor",
  "hero_spells": [
    "heal",
    "hurt",
    "sleep",
    "radiant",
    "stopspell",
    "outside",
    "return",
    "repel",
    "healmore",
    "hurtmore"
  ],
  "items": [
    {
      "name": "Fairy Flute",
      "id": "fairy_flute",
      "desc": "Puts the Golem boss to sleep; required to defeat the Golem"
    }
  ],
  "opened_chests": {},
  "unlocked_doors": {},
  "bridge_built": true
}
