{
  "$schema": "../../../schemas/v1/save_state.schema.json",
  "name": "Stair: Erdrick's Cave B1 → B2 (down stairs at 10,10)",
  "description": "Debug save state for stair transition: Erdrick's Cave B1 → B2 (down stairs at 10,10). Hero stands on the stair tile ready to transition.",
  "scene": "ErdricksCaveB1",
  "tile": "10,10",
  "facing": "down",
  "come_from": "debug",
  "gold": 1000,
  "hero_name": "ERDRICK",
  "hero_level": 7,
  "hero_hp": 40,
  "hero_hp_max": 40,
  "hero_mp": 26,
  "hero_mp_max": 26,
  "hero_str": 13,
  "hero_agl": 13,
  "hero_atk": 13,
  "hero_def": 12,
  "hero_exp": 450,
  "hero_weapon": "hand_axe",
  "hero_armor": "chain_mail",
  "hero_spells": [
    "heal",
    "hurt",
    "sleep"
  ],
  "items": [
    {
      "name": "Torch",
      "id": "torch",
      "desc": "Illuminates caves"
    }
  ],
  "opened_chests": {},
  "unlocked_doors": {},
  "bridge_built": false
}
