{
  "$schema": "../../../schemas/v1/save_state.schema.json",
  "name": "Level 21 - Charlock Grind",
  "description": "Level 21 late-game grind preset at Charlock Castle 1F with endgame gear, all spells, and the Rainbow Bridge built.",
  "scene": "CharlockCastleB1",
  "tile": "11,11",
  "facing": "up",
  "come_from": "charlock_castle_1f",
  "gold": 21000,
  "hero_name": "ERDRICK",
  "hero_level": 21,
  "hero_hp": 149,
  "hero_hp_max": 149,
  "hero_mp": 128,
  "hero_mp_max": 128,
  "hero_str": 36,
  "hero_agl": 38,
  "hero_atk": 36,
  "hero_def": 36,
  "hero_exp": 33000,
  "hero_weapon": "erdricks_sword",
  "hero_armor": "erdricks_armor",
  "hero_spells": [
    "heal",
    "hurt",
    "sleep",
    "radiant",
    "stopspell",
    "outside",
    "return",
    "repel",
    "healmore",
    "hurtmore"
  ],
  "items": [],
  "opened_chests": {},
  "unlocked_doors": {},
  "bridge_built": true
}
