{
  "$schema": "../../../schemas/v1/save_state.schema.json",
  "name": "Stair: Grave B2 → B3 (down stairs at 13,2)",
  "description": "Debug save state for stair transition: Grave B2 → B3 (down stairs at 13,2). Hero stands on the stair tile ready to transition.",
  "scene": "GarinhamB2",
  "tile": "13,2",
  "facing": "down",
  "come_from": "debug",
  "gold": 3000,
  "hero_name": "ERDRICK",
  "hero_level": 12,
  "hero_hp": 74,
  "hero_hp_max": 74,
  "hero_mp": 50,
  "hero_mp_max": 50,
  "hero_str": 20,
  "hero_agl": 20,
  "hero_atk": 20,
  "hero_def": 18,
  "hero_exp": 4000,
  "hero_weapon": "broad_sword",
  "hero_armor": "half_plate",
  "hero_spells": [
    "heal",
    "hurt",
    "sleep",
    "radiant",
    "stopspell",
    "outside"
  ],
  "items": [],
  "opened_chests": {},
  "unlocked_doors": {},
  "bridge_built": false
}
