{
  "$schema": "../../../schemas/v1/save_state.schema.json",
  "name": "Level 15 - Cantlin Trek",
  "description": "Level 15 trek toward Cantlin with Magic Armor, Repel, and the Fairy Flute.",
  "scene": "WorldMap",
  "tile": "70,100",
  "facing": "up",
  "come_from": "debug",
  "gold": 8000,
  "hero_name": "ERDRICK",
  "hero_level": 15,
  "hero_hp": 86,
  "hero_hp_max": 86,
  "hero_mp": 72,
  "hero_mp_max": 72,
  "hero_str": 24,
  "hero_agl": 24,
  "hero_atk": 24,
  "hero_def": 24,
  "hero_exp": 10000,
  "hero_weapon": "broad_sword",
  "hero_armor": "magic_armor",
  "hero_spells": [
    "heal",
    "hurt",
    "sleep",
    "radiant",
    "stopspell",
    "outside",
    "return",
    "repel"
  ],
  "items": [
    {
      "name": "Fairy Flute",
      "id": "fairy_flute",
      "desc": "Puts the Golem boss to sleep; required to defeat the Golem"
    }
  ],
  "opened_chests": {},
  "unlocked_doors": {},
  "bridge_built": false
}
