{
  "$schema": "../../../schemas/v1/save_state.schema.json",
  "name": "Stair: Castle 1F → Tantegel Basement (down stairs at 13,4)",
  "description": "Debug save state for stair transition: Castle 1F → Tantegel Basement (down stairs at 13,4). Hero stands on the stair tile ready to transition.",
  "scene": "Castle1F",
  "tile": "13,4",
  "facing": "down",
  "come_from": "debug",
  "gold": 4000,
  "hero_name": "ERDRICK",
  "hero_level": 14,
  "hero_hp": 78,
  "hero_hp_max": 78,
  "hero_mp": 64,
  "hero_mp_max": 64,
  "hero_str": 22,
  "hero_agl": 22,
  "hero_atk": 22,
  "hero_def": 20,
  "hero_exp": 7500,
  "hero_weapon": "broad_sword",
  "hero_armor": "full_plate",
  "hero_spells": [
    "heal",
    "hurt",
    "sleep",
    "radiant",
    "stopspell",
    "outside",
    "return"
  ],
  "items": [],
  "opened_chests": {},
  "unlocked_doors": {},
  "bridge_built": false
}
