{
  "$schema": "../../../schemas/v1/save_state.schema.json",
  "name": "Level 14 - Swamp Cave Princess",
  "description": "Level 14 Swamp Cave preset representing the princess rescue stretch with spells through Return.",
  "scene": "SwampCave",
  "tile": "4,30",
  "facing": "down",
  "come_from": "world_map",
  "gold": 4000,
  "hero_name": "ERDRICK",
  "hero_level": 14,
  "hero_hp": 78,
  "hero_hp_max": 78,
  "hero_mp": 64,
  "hero_mp_max": 64,
  "hero_str": 22,
  "hero_agl": 22,
  "hero_atk": 22,
  "hero_def": 20,
  "hero_exp": 7500,
  "hero_weapon": "broad_sword",
  "hero_armor": "full_plate",
  "hero_spells": [
    "heal",
    "hurt",
    "sleep",
    "radiant",
    "stopspell",
    "outside",
    "return"
  ],
  "items": [],
  "opened_chests": {},
  "unlocked_doors": {},
  "bridge_built": false
}
