{
  "$schema": "../../../schemas/v1/save_state.schema.json",
  "name": "Level 02 - Brecconary Outskirts",
  "description": "Level 2 milestone just outside Brecconary, ready for nearby overworld grinding.",
  "scene": "WorldMap",
  "tile": "50,44",
  "facing": "up",
  "come_from": "debug",
  "gold": 200,
  "hero_name": "ERDRICK",
  "hero_level": 2,
  "hero_hp": 22,
  "hero_hp_max": 22,
  "hero_mp": 0,
  "hero_mp_max": 0,
  "hero_str": 5,
  "hero_agl": 4,
  "hero_atk": 5,
  "hero_def": 2,
  "hero_exp": 7,
  "hero_weapon": "club",
  "hero_armor": "clothes",
  "hero_spells": [],
  "items": [],
  "opened_chests": {},
  "unlocked_doors": {},
  "bridge_built": false
}
