{
  "$schema": "../../../schemas/v1/save_state.schema.json",
  "name": "Level 01 - Throne Room Start",
  "description": "Fresh level 1 hero staged in Brecconary with starter equipment and spending gold.",
  "scene": "ThroneRoom",
  "tile": "4,5",
  "facing": "down",
  "come_from": "debug",
  "gold": 120,
  "hero_name": "ERDRICK",
  "hero_level": 1,
  "hero_hp": 15,
  "hero_hp_max": 15,
  "hero_mp": 0,
  "hero_mp_max": 0,
  "hero_str": 4,
  "hero_agl": 4,
  "hero_atk": 4,
  "hero_def": 2,
  "hero_exp": 0,
  "hero_weapon": "bamboo_pole",
  "hero_armor": "clothes",
  "hero_spells": [],
  "items": [],
  "opened_chests": {},
  "unlocked_doors": {},
  "bridge_built": false
}
